{
  "action": {
    "amount_minor": 25000,
    "currency": "USD",
    "destination_id": "account_synthetic_a",
    "merchant_id": "merchant_synthetic_alpha",
    "terms": "RECURRING_MONTHLY"
  },
  "action_digest": "sha256:48afd63f96ce5aa3efc8c38c1ba2cd1f19b37d86c9046580d06b5f98bd667134",
  "aud": "haltseal-public-receipt",
  "authority": {
    "authorized_amount_minor": 25000,
    "currency": "USD",
    "destination_id": "account_synthetic_a",
    "merchant_id": "merchant_synthetic_alpha",
    "remaining_uses": 1,
    "status": "CURRENT",
    "terms": "ONE_TIME"
  },
  "authority_digest": "sha256:c75ebc728de8c8fba8e11b0f820f3aecf2475a399a90ee14b36f7a8b5bd8f009",
  "boundary": {
    "live_provider_call": false,
    "patent_license_granted": false,
    "payment_credentials_accepted": false,
    "production_rights": false,
    "profile_version": "haltseal-public-resolve-1",
    "synthetic": true
  },
  "challenge_id": "hsc_sample_fixed_000000000001",
  "consumption": {
    "state_after": "AVAILABLE",
    "state_before": "AVAILABLE"
  },
  "decision": "REFUSE",
  "emission": {
    "disposition": "NO_REQUEST",
    "existing_request_record_id": null,
    "new_request_count": 0,
    "outcome": "NONE",
    "synthetic_request_record_id": null,
    "total_request_count_for_use": 0
  },
  "iat": 1785600000,
  "iss": "https://eval.meridianverity.com",
  "jti": "hsr_sample_refuse_00000000001",
  "profile_version": "haltseal-public-resolve-1",
  "reason_codes": [
    "TERMS_MISMATCH"
  ]
}
