{
  "action": {
    "amount_minor": 25000,
    "currency": "USD",
    "destination_id": "account_synthetic_a",
    "merchant_id": "merchant_synthetic_alpha",
    "terms": "ONE_TIME"
  },
  "action_digest": "sha256:fc0348c18518a55fecddebd3d2765c871eb6a18f6b8fca96122aabb5869585de",
  "aud": "haltseal-public-receipt",
  "authority": {
    "authorized_amount_minor": 25000,
    "currency": "USD",
    "destination_id": "account_synthetic_a",
    "merchant_id": "merchant_synthetic_alpha",
    "remaining_uses": 1,
    "status": "CURRENT",
    "terms": "ONE_TIME"
  },
  "authority_digest": "sha256:c75ebc728de8c8fba8e11b0f820f3aecf2475a399a90ee14b36f7a8b5bd8f009",
  "boundary": {
    "live_provider_call": false,
    "patent_license_granted": false,
    "payment_credentials_accepted": false,
    "production_rights": false,
    "profile_version": "haltseal-public-resolve-1",
    "synthetic": true
  },
  "challenge_id": "hsc_sample_fixed_000000000001",
  "consumption": {
    "state_after": "CONSUMED",
    "state_before": "AVAILABLE"
  },
  "decision": "ACCEPT",
  "emission": {
    "disposition": "ONE_SYNTHETIC_REQUEST",
    "existing_request_record_id": null,
    "new_request_count": 1,
    "outcome": "RECORDED",
    "synthetic_request_record_id": "hsreq_sample_accept_0000000001",
    "total_request_count_for_use": 1
  },
  "iat": 1785600000,
  "iss": "https://eval.meridianverity.com",
  "jti": "hsr_sample_accept_000000000001",
  "profile_version": "haltseal-public-resolve-1",
  "reason_codes": [
    "AUTHORITY_CURRENT",
    "ACTION_EXACT",
    "USE_AVAILABLE"
  ]
}
